{
  "version": "0.9",
  "uri": "https://standard.open-contracting.org/infrastructure/0.9/en/_static/example.json",
  "publishedDate": "2018-12-10T15:53:00Z",
  "publisher": {
    "name": "Open Data Services Co-operative Limited",
    "scheme": "GB-COH",
    "uid": "9506232",
    "uri": "http://data.companieshouse.gov.uk/doc/company/09506232"
  },
  "license": "http://opendatacommons.org/licenses/pddl/1.0/",
  "publicationPolicy": "https://standard.open-contracting.org/1.1/en/implementation/publication_policy/",
  "projects": [
    {
      "id": "oc4ids-bu3kcz-m75-junctions-4-to-5-smart-motorway",
      "identifiers": [
        {
          "id": "M75/SM/4-5",
          "scheme": "internal"
        }
      ],
      "updated": "2018-12-10T15:53:00Z",
      "title": "M75 Junctions 4 to 5 upgrade smart motorway",
      "description": "Upgrading the 5km stretch of the M75 near Birmingham Airport, between junction 4 near Patcham and junction 5 at Windlesham, to an all-lane running smart motorway.",
      "status": "maintenance",
      "period": {
        "startDate": "2016-01-01T00:00:00Z",
        "endDate": "2018-12-10T00:00:00Z",
        "durationInDays": 1074
      },
      "identificationPeriod": {
        "startDate": "2016-01-01T00:00:00Z",
        "endDate": "2016-06-30T00:00:00Z"
      },
      "preparationPeriod": {
        "startDate": "2016-07-01T00:00:00Z",
        "endDate": "2016-12-31T00:00:00Z"
      },
      "implementationPeriod": {
        "startDate": "2017-01-01T00:00:00Z",
        "endDate": "2017-06-30T00:00:00Z"
      },
      "completionPeriod": {
        "startDate": "2017-07-01T00:00:00Z",
        "endDate": "2017-12-31T00:00:00Z"
      },
      "maintenancePeriod": {
        "startDate": "2018-01-01T00:00:00Z",
        "endDate": "2040-07-01T00:00:00Z"
      },
      "decommissioningPeriod": {
        "startDate": "2040-07-01T00:00:00Z",
        "endDate": "2041-06-30T00:00:00Z"
      },
      "sector": [
        "transport",
        "transport.road"
      ],
      "additionalClassifications": [
        {
          "scheme": "COFOG",
          "id": "04.5.1",
          "description": "Road transport (CS)"
        }
      ],
      "type": "expansion",
      "purpose": "To help support local economic growth and maintain mobility.",
      "relatedProjects": [
        {
          "id": "1",
          "scheme": "oc4ids",
          "identifier": "oc4ids-bu3kcz-m75-junctions-4-to-5-construction",
          "relationship": "construction",
          "title": "Original construction of M75 J4-5"
        }
      ],
      "assetLifetime": {
        "startDate": "2018-07-01T00:00:00Z",
        "endDate": "2040-07-01T00:00:00Z",
        "durationInDays": 8027
      },
      "locations": [
        {
          "id": "001",
          "description": "M75 J4 Patcham Interchange",
          "geometry": {
            "type": "Point",
            "coordinates": [
              52.2571843,
              -0.1163333
            ]
          },
          "gazetteer": {
            "scheme": "GEONAMES",
            "identifiers": [
              "2657507"
            ]
          },
          "address": {
            "streetAddress": "Patcham Interchange, New Road",
            "locality": "Patcham",
            "region": "Westshire",
            "postalCode": "WS20 5TV",
            "countryName": "United Kingdom"
          },
          "uri": "https://www.openstreetmap.org/node/202995"
        },
        {
          "id": "002",
          "description": "M75 J5 Windlesham interchange",
          "geometry": {
            "type": "Point",
            "coordinates": [
              52.1373584,
              -0.1198955
            ]
          },
          "gazetteer": {
            "scheme": "OSMN",
            "identifiers": [
              "https://www.openstreetmap.org/node/26571091"
            ]
          },
          "address": {
            "streetAddress": "Windlesham Interchange, Old Road",
            "locality": "Windlesham",
            "region": "Westshire",
            "postalCode": "WS21 6RZ",
            "countryName": "United Kingdom"
          },
          "uri": "https://www.openstreetmap.org/node/1638915385"
        }
      ],
      "budget": {
        "description": "Budget allocation for Motorways UK, aligned with the 2016-2018 strategic plan.",
        "amount": {
          "amount": 40000000,
          "currency": "GBP"
        },
        "requestDate": "2015-05-30T00:00:00Z",
        "approvalDate": "2015-06-24T00:00:00Z",
        "budgetBreakdowns": [
          {
            "id": "1",
            "description": "Breakdown by year of implementation",
            "budgetBreakdown": [
              {
                "id": "2016",
                "description": "2016 budget allocation",
                "amount": {
                  "amount": 10000000,
                  "currency": "GBP"
                },
                "period": {
                  "startDate": "2016-01-01T00:00:00Z",
                  "endDate": "2016-12-31T00:00:00Z"
                },
                "sourceParty": {
                  "name": "Motorways UK",
                  "id": "GB-GOR-XX1234"
                }
              },
              {
                "id": "2017",
                "description": "2017 budget allocation",
                "amount": {
                  "amount": 20000000,
                  "currency": "GBP"
                },
                "period": {
                  "startDate": "2017-01-01T00:00:00Z",
                  "endDate": "2017-12-31T00:00:00Z"
                },
                "sourceParty": {
                  "name": "Motorways UK",
                  "id": "GB-GOR-XX1234"
                }
              },
              {
                "id": "2018",
                "description": "2018 budget allocation",
                "amount": {
                  "amount": 10000000,
                  "currency": "GBP"
                },
                "period": {
                  "startDate": "2018-01-01T00:00:00Z",
                  "endDate": "2018-12-31T00:00:00Z"
                },
                "sourceParty": {
                  "name": "Motorways UK",
                  "id": "GB-GOR-XX1234"
                }
              }
            ]
          }
        ],
        "finance": [
          {
            "id": "1",
            "assetClass": [
              "debt"
            ],
            "type": "loan",
            "concessional": true,
            "value": {
              "amount": 50000000,
              "currency": "USD"
            },
            "source": "Green Climate Fund",
            "financingParty": {
              "id": "1",
              "name": "United Nations Development Programme"
            },
            "period": {
              "startDate": "2024-01-01T00:00:00Z",
              "endDate": "2043-12-31T00:00:00Z"
            },
            "paymentPeriod": {
              "startDate": "2029-01-01T00:00:00Z",
              "endDate": "2043-12-31T00:00:00Z"
            },
            "interestRate": {
              "margin": 0.0075
            },
            "description": "Annual principal repayment years 11–20 (% of initial principal): 6.7%. Service fee (per annum): 0.50%. Commitment fee (per annum): Up to 0.75%."
          }
        ]
      },
      "costMeasurements": [
        {
          "id": "1",
          "date": "2024-05-01T00:00:00Z",
          "lifeCycleCosting": {
            "value": {
              "amount": 60000000,
              "currency": "USD"
            }
          },
          "costGroups": [
            {
              "id": "1",
              "category": "endOfLife",
              "costs": [
                {
                  "id": "1",
                  "value": {
                    "amount": 5000000,
                    "currency": "USD"
                  },
                  "classification": {
                    "id": "4.02",
                    "scheme": "icms",
                    "description": "Decommissioning and decontamination"
                  }
                }
              ]
            }
          ]
        }
      ],
      "parties": [
        {
          "name": "Motorways UK",
          "id": "GB-GOR-XX1234",
          "identifier": {
            "scheme": "GB-GOR",
            "legalName": "Motorways UK",
            "id": "XX1234",
            "uri": "https://government-organisation.register.gov.uk/records/XX1234"
          },
          "additionalIdentifiers": [
            {
              "scheme": "GB-GOV",
              "legalName": "Motorways UK",
              "id": "ABCDE"
            }
          ],
          "address": {
            "postalCode": "LL55 4NY",
            "countryName": "United Kingdom",
            "streetAddress": "8 Mountain Walk",
            "region": "Westshire",
            "locality": "Patcham"
          },
          "contactPoint": {
            "name": "Motorways Manager",
            "email": "EX12345@motorwaysuk.gov.uk",
            "telephone": "+44 0123 456 7890",
            "faxNumber": "+44 0123 456 7891"
          },
          "roles": [
            "procuringEntity",
            "buyer",
            "publicAuthority",
            "funder",
            "payee"
          ],
          "people": [
            {
              "id": "1",
              "name": "Jane Bloggs",
              "jobTitle": "Chair"
            }
          ],
          "classifications": [
            {
              "id": "national",
              "scheme": "costIdsAdministrativeLevel"
            }
          ]
        },
        {
          "name": "A1 Expert Smart Moto Design",
          "id": "GB-COH-11111111",
          "identifier": {
            "scheme": "GB-COH",
            "id": "11111111",
            "legalName": "A1 Expert Smart Moto Design Ltd",
            "uri": "https://beta.companieshouse.gov.uk/company/11111111"
          },
          "address": {